x_index,y_index,extra_1,hex_key,terrain,settlement,extra_2,author,description,more_info_url,themes
09,09,,0909,fin,,,Casey Garske,Ghouls live under the ancient battlefield here. The ghoul king wields the sword of an ancient prince who died on the battlefield.,,
09,10,,0910,fin,,,Joey Lindsey,"This expanse gets rockier to the south, and the shore with [[0911]] is one large flat stone expanse. Huge Lizards come here to bask in the sun and drink the water. Zox from [[0810]] feeds people he kills to them, and random items litter the ground and shallows.",,
09,10,,0910,fin,,,James Smith,"Small town, recently razed because its inhabitants worshiped the FF Elemental Princes. Patrol of 30 soldiers from [[0909]] is hunting for survivors and putting them to the sword.",,
09,11,,0911,sea,,,Ray Colina,Relatively shallower waters make this a feeding ground for sea life including 2-24 Crabmen.,,
09,12,,0912,woodland,,,Ray Colina,"Not far from the shore, hidden under branches and brambles is a longboat. At first glance it appears a to be Viking vessel but closer inspection reveals it to be of White Elf construction.",,
09,13,,0913,woodland,,,Zak Smith,Ancient pile of boar and snow leopard bones. Digging beneath for an hour reveals a plinth of depthless black stone that may account for all the preternaturally smart monkeys on this hex map.,,
09,14,,0914,fin,,,Casey Garske,The fossilized jaws of a Tyrannosaurus jut from the bare rock here. A warrior praying within the jaws is granted a +1 to attack and damage while within the surrounding hexes.,,
09,15,,0915,plain,,,Zak Smith,"Armored chaos champions on metallic steeds roam this area, obeying ancient orders to defend the overgrown and partially buried skull-shaped temple. The necromancer in [[0715]] seeks this hidden temple as it is holds the key to the energies responsible for all the undead on this hexmap.",,
09,15,,0915,,,,Wayne Snyder,A prosperous vineyard run by retired halfling adventures.,,
09,16,,0916,plain,,,Shaine Edwards,A family of Halfling moonshiners ride an enormous tortoise. Their assortment of cheap liquors has made for strained relations with the vintners in hex 09 15.,,
09,17,,0917,fin,,,Ray Colina,"A party of 8 White Elves in warmasks and their half-ogre slave pulling cart as they return from the dungeon in [[0816]], they are in route to their ship in [[0912]]. Inside the cart is 8000 gp in tapestries, candlesticks, offertory containers, oils, and idols, all of them of them of fine make and bearing snake motifs. There is also a beautiful green skinned female in a glass coffin; she wears snake themed jewelry and little else.",,
09,18,,0918,hill,,,Zak Smith,A feast set for a king lies exposed to the elements but unperturbed. The tablecloth and chair cushions are a spongy moss--anyone eating it is cursed to guard the plum orchard in [[0817]].,,
09,19,,0919,woodland,,,Matthew Burack,"A gnomish survey team and their clockwork servants/guards have staked out the corners of this hex and are in the process of creating a detailed map of the area that they refer to as ""Sector Oh Nine One Nine"". Their base camp is near a set of ancient standing stones in a hexagonal ring around a hexagonal altar in the exact center of the area they are surveying.",,
09,20,,0920,plain,,,Matt Maranda,A lake in grassland with several abandoned huts on its shores. The horses of [[0821]] and the shepherds from [[0820]] sometime pasture near it.,,
09,21,,0921,plain,,,Mike Evans,"A field of knee high grass that is razor sharp that works its way into the wounds of those who are cut, infecting the host.  When rolled up and smoked can see through time.",,
09,22,,0922,woodland,SEEKERSFILE,,Zak Smith,Pair of settlements in the forest: SKYVVEN-human and SEEKERSFILE--elven. Both are hospitable.,,
09,23,,0923,plain,,,Wayne Snyder,A ring of great standing stones carved from bright orange quartz sits on a hill. Beneath the altar is the entrance to a labyrinth which lies below the hill. Infested with crypt ghasts the maze is also home to seven magic sacrificial daggers made from the same orange quartz.,,
09,24,,0924,woodland,,,Shaine Edwards,"A sickly forest hides the entrance to Oozopolis, an abandoned subterranean town now haunted by slimes. A pair of Druids investigate.",,
09,24,,0924,woodland,,,Ben Djarum,a sad satyr sits here playing a sad song on a silver sitar. He takes requests and will give those who appreciate his music a small copper key.,,
09,25,,0925,sea,,,Alex Williamson,A constant bubbling near the shore here belies an underground spring which connects to a flooded cave system. If followed for 2 miles the caves rise above the water line and connect to the labyrinth in [[0923]].,,
09,26,,0926,sea,,,Martin Bay Thomsen,Goblin-built Wooden Submarine -- More or less sea-wothy,,
09,26,,0926,sea,,,Joey Lindsey,"A massive hollowed-out insect head at the bottom of the lake. If one swims into the left eye, violently rushing water takes you through tunnels, eventually emerging in [[1226]]. Bits of flesh and dark liquids eddy above the right eye; anyone swimming inside is wracked with pain and gains insectoid mutations.",,
09,27,,0927,woodland,,,Martin Bay Thomsen,Hidden shed contains wooden torpedoes for the submarine in [[0926]]. Over time they sweat nitroglycerine and are highly unstable,,
09,28,,0928,woodland,,,Wayne Snyder,"In the center of this dark forest, a band of surly orks run a lumber mill powered by giant rats running in huge wooden wheels.",,
10,01,,1001,hill,,,Zak Smith,"Pile of recently deceased adventurers and wolves that slew each other after the adventurers visited Nyngloom Castle and Fellmount Abbey (hexes [[0901]] [[0902]] ) and the dwarven camp [[0721]]. They have extensive gear, notes and maps.",,
10,02,,1002,sand,,,Martin Bay Thomsen,"Gnomish Junkyard. Pretty much anything made out of metal, glass, wood or stone can be found here, only catch is that whenever you find something you want, the gnomes suddenly remember they need that exact part for something very important.",,
10,03,,1003,plain,,,Zak Smith,A child that can't speak but merely croak like a frog. A crawling hand the size of a house.,,
10,04,,1004,plain,,,Zak Smith,Large pond contains a giant teakettle wherein dwells Chleresta the Lazy Witch--responsible for freaks in [[1003]]. She forgot some important shoes when she moved from [[0103]] and will attempt to convince/force visitors to retrieve them.,,
10,05,,1005,woodland,,,Matt Maranda,A tower in the woods manned by elves; guard a well said to give the imbiber greater insight to the doings of the gods.,,
10,06,,1006,woodland,,,Chris Blauwkamp,"A thatched hut with seven brothers, seeking seven brides. The brothers are ogre magi.",,
10,07,,1007,woodland,,,Joey Lindsey,"A small band of heavily wounded survivors of tribal warfare to the south and east. They seek protectors for their pregnant leader, whose child they believe will unite the tribes in adulthood. The Wizard in [[0411]] owes them a favor, as does the Amazon in [[0419]].",,
10,08,,1008,woodland,,,Zak Smith,Large wardrum in a crumbling tower. If played it will cause the constructs in [[0908]] to attack the ghouls in [[0909]].,,
10,09,,1009,plain,,,Joey Lindsey,"a war party of hill tribesmen, chasing the small band in [[1007]]. They expect their quarry to seek out the Ogre Magi, and are armed for them - Periapts of True Seeing, herbal unguent that works like napalm, and a shaman with Dispel Magic.",,
10,10,,1010,hill,,,Zak Smith,"Princess Adria and her retinue are going to visit her sister--sent here months ago to marry (and enslave) one of the ogre mages [[1006]]. Unbeknownst to Adria or the angry ogres, her sister never made it to the wedding because she is trapped in [[0707]] .",,
10,11,,1011,plain,,,Ray Colina,"The cairns in these plains hold the most honored dead of nomadic tribes. One of the mounds has recently been broken into or out of, whatever was inside is gone.",,
10,12,,1012,woodland,,,Duncan Young,"The corpse of a giant, buried in undergrowth but showing no signs if decay or consumption. An orchard with a sign reading ""Keep out! No scrumping! Trespassers will be pulped!""",,
10,12,,1012,woodland,,,Humza Kazmi,"The orc tribe here are all Terminator-2 liquid-shimmery-metal (AC improved by 2, weapons out of hands). The trees in this forest are also all different types of metal, with a giant pool of mercury at the heart of the forest.",,
10,13,,1013,woodland,,,Wayne Snyder,"This forest grows thick with razor weed, poison humbert, stinging ghost leaf and strangle wort. Travel rates through this area are reduced by 75%.",,
10,14,,1014,plain,DIES ARKATT,,Zak Smith,DIES ARKATT (settlement) Two colossal statues (? or victims of the Dracolisk in [[1413]]) of ancient gods crashed together long ago here but remain essentially vertical. A largely vertical settlement has grown up on and around them.,,
10,14,,1014,plain,,,Courtney Campbell,"A geomancer sits by the side of the road, depressed over fighting with his wife. His wife is a naga paladin. There is a hobgoblin witch nearby that creates twig demons to disrupt their relationship.",http://hackslashmaster.blogspot.ca/2013/04/on-hexbraken.html,
10,15,,1015,plain,,,Thomas Fitzgerald,"Vriminynthe Gholthaniel: Elvish lancer, banished vassal of Baron Cytorrak [[0709]], rides a feathered tyrannosaur, seeks adventure.",,
10,16,,1016,woodland,,,Edgar Johnson,Glen of Howling Trees. This haunted wood shelters a variety of ghosts.,,
10,17,,1017,woodland,,,Joey Lindsey,"Crkt Bibin, a dense growth of trees home to a secret city of hundreds of murderous bandits. If a bag of 50 GP per traveller is left at the proper spot, the bandits will leave you alone. If you were well-liked in DIES ARKATT [[1014]], they will have told you of the ""Crkt Bibin Tax"".",,
10,17,,1017,woodland,,,Zak Smith,The nagas in [[0322]] and [[0121]] worship this statue of Mistress of All Perils. The geomancer's wife [[1014]] seeks its destruction but her grotesque appearance makes it difficult for her to recruit aid so she has recently taken to wearing a shell of ornate humanoid plate armor fixed to a horse to hide her wormlike body.,,
10,18,,1018,hill,,,Richard G,"the hills have many small rockpools. One pool, limpid blue, acts as a one-way teleporter to hex [[0310]].",,
10,19,,1019,woodland,,,Martin Bay Thomsen,"5' wide shaft, impossibly deep.",,
10,20,,1020,plain,,,Richard G,"3d20 goats. If disturbed they stampede, screaming, into adjacent grassland hexes.",,
10,21,,1021,sand,,,Richard Rush,"An enormous constrictor is noisily giving birth... to small-sized, fully-grown people. They're mentally infantile, and lack belly buttons.",,
10,21,,1021,sand,,,Ray Colina,"Akerbeltz, the dancing hill demon, a twelve foot tall goat-spirit with adamantine horns, has made this rugged terrain his home. He either attacks or offers to answer a question, 50/50 chance. He can summon 3-36 goats from [[1020]].",,
10,22,,1022,woodland,,,Richard G,a tree with carnivorous roots and fruits. The fruit are delicious and nutritious but if stored in packs they'll eat all the rest of your food and if eaten they cause 1d6 damage 1d6 hours after eating.,,
10,23,,1023,woodland,,,Richard G,"a deep gorge with trees growing horizontally out of the sides, forming a living jungle gym. Inhabited by climbing, sociable, talkative monkey con-artists.",,
10,24,,1024,woodland,,,Jason Sholtis,"Undead greenskeepers tend acre after acre of impeccably tidy lawns, gardens, manicured shrubberies, decorative arrangements of stones, water features, etc. They work ceaselessly, expanding their project in all directions, pausing only to destroy those who would impede their progress .",,
10,25,,1025,woodland,,,Dave Younce,There is a 50' wide unfinished stone-lined canal running NE/SW here; the apparently dwarven engineering work to connect the lake at [[0926]] with the one at [[1125]] was about halfway complete when work stopped (the oldest dwarf in [[UPSIDE]] [[0114]] was a digger here as a boy and can tell wild stories about it for the price of a pint of ale). It is now overgrown with vines and home only to a few giant frogs with delicious flesh and faintly glowing eyes.,,
10,26,,1026,woodland,,,Ray Colina,"Angerboda, Witch of the Iron Wood, a giantess-witch, lives here with 2d12 ogres. The nuns of the Oakheart Academy in [[0305]] mocked her and have made a lifelong enemy. Abatte in [[0624]] owes her a favor, for the dark blessing she preformed for his son.",,
10,26,,1026,woodland,,,Martin Bay Thomsen,"Tribe of Gorilla-Men, hates all monkeys, especially he intelligent ones. The position of village chief can be contested through one-on-one melee combat followed by a game of chess. Current leader wields a +2 monkeybane club.",,
10,27,,1027,woodland,,,Jason Sholtis,"A party of vicious barbarian heroes make their way north, to smite the Mistress of All Perils (hex [[1017]]) at the behest of their vision-beset shaman, who also told them to befriend a worm-woman. Very friendly to any who openly blaspheme against the Mistress.",,
10,28,,1028,,,,,,,
11,01,,1101,hill,,,Zak Smith,"Village of Morons. The black plinth in [[0913]] awakens monkeys by trading parts of their consciousness with that of nearby humans, many of these unfortunate idiots have gathered here for some reason.",,
11,02,,1102,hill,,,Jason Sholtis,"Scattered crappy campsites of the Half-morons. They have no idea why they are here, but enjoy sticking it to the Morons of [[1101]] at every opportunity.",,
11,03,,1103,mountain,,,Richard G,"gigantic smoking cone looks more like a factory chimney than a volcano. The smoke slows thinking and causes confusion, but is strangely addictive.",,
11,04,,1104,sand,,,Martin Bay Thomsen,Sage religiously writes down anything ever said to him directly. Travels in a wagon filled to the brim with tomes he has written.,,
11,05,,1105,sea,,,Richard G,"sandbars extend from shore forming a causeway to [[1205]] for the hour of lowest tide. Morons from [[1101]] frequently get trapped by the incoming tide, to the enormous but silent amusement of the snails.",,
11,06,,1106,sea,,,Richard G,"The witch from [[0103]], clamped like a limpet onto the back of the butcher from [[0408]], sculling SE with a long spoon. The butcher is floating, face just out of the water, weeping softly. If left uninterrupted they will eventually get to the island at [[1805]], where the witch will sacrifice the butcher to summon an earthquake carp.",,
11,07,,1107,sea,,,Jason Sholtis,"Seared debris floats around, all that remains of a sorcerer's experimental ironclad warship that violently exploded on its maiden voyage, killing the sorcerer and most of her minions. Her secret harbor and research facility (now unmanned but for undead cleaning crew) remains concealed by illusion on the shores of  hex [[1108]].",,
11,08,,1108,woodland,,,Jürgen Mayer,"Portal to the fae realm, heavily guarded by the crimson faerie court. 90% chance to encounter a reception committee of 3d4 fierce redcap guardians.",,
11,09,,1109,woodland,,,Taar Koth,Pattern of carved stones surrounding altar. Wereboar preparing for a ritual to sacrifice himself to achieve apotheosis.,,
11,09,,1109,woodland,,,Niles Calder,"On moonless nights a coven of witches celebrate their dark rites. Witnesses must save versus spells or be sucked into their merry making, becoming willing subjects to whatever they do which could be fun but naughty, but probably isn't. Those who pass their saves are pursued by dark forces (Phantasmal Killer each) for 1d6 hexes, or until dawn, which ever comes first. 13 Witches, MU level 2d6.",,
11,10,,1110,hill,,,Zak Smith,"Twisted treants dwell here, moaning in the north wind. They mutilate visitors and drop the pieces down a well full of white insects.",,
11,11,,1111,hill,,,Jürgen Mayer,"Burial mounds of the eleven kings, secured by powerful magic. The shaman in [[1009]] knows how to open them, but demands a big sacrifice for the information. The precious grave goods are protected by sophisticated traps.",,
11,11,,1111,hill,,,James Young,"A wolf, apparently ordinary. When damaged an entire other wolf jumps out of its mouth, and so on.",http://tenfootpolemic.blogspot.com.au/2013/04/monster-packed-wolves.html,
11,12,,1112,hill,,,Reece Carter,"a large cave opening is here, it extends about 50m back and is about 10-15m tall. Its really nothing, just good protection against the elements",,
11,13,,1113,hill,,,Reece Carter,"goblin cavelry are here, they are riding on some form of mountain goat. The goblins count as 3rd level fighters, the mountain goats count as a war horse, 1D3 per party member will attack",,
11,14,,1114,hill,,,Trent B,"ancient tower on the hillside, overlooks the grasslands to the south. Table inside is a carved stone map of the mountains northwest.",,
11,15,,1115,plain,,,Jürgen Mayer,"Strawberry fields. In the village of Forehome, any valuable goods can be traded for delicious strawberries. The local priest controls a powerful stone golem who is sent to deal with strawberry thieves.",,
11,16,,1116,plain,SHALLOWGROVE,,Trent B,SHALLOWGROVE. Squalid settlement of 49 human outcasts. Send criminals and ill people to the howling glen in [[1016]].,,
11,17,,1117,plain,,,Martin Bay Thomsen,Goblin and/or Monkey desperately clinging on to giant silken balloon floating 100 ft in the air. Will shout offers of a magic ring as reward for getting it down safely.,,
11,18,,1118,woodland,,,James Young,"Jagged, close-set pines make this hex annoying to move through.",,
11,19,,1119,fin,,,Jürgen Mayer,Old meteor impact crater. Lucky prospectors might find meteor splinters.,,
11,20,,1120,lake,,,Trent B,"A dark, misty swamp surrounds a murky spring and its accompanying treasure-having Temple Of Leeches. Disease bearing leech hybrid swamp creatures hound every step and a cult of 9 leech-headed men, elves and dwarves attempt to magically spread the leeches corrupting influence beyond the swamp temple.",,
11,21,,1121,woodland,,,Martin Bay Thomsen,Naked gnome convinced he is in fact invisible. Cannot be convinced otherwise and does not respond to logic.,,
11,22,,1122,mountain,,,James Raggi,"A confused, distracted, (immediately) forgetful old hermit lives atop the mountain here who thinks any visitors are his kids and grandkids and serves them his mountain goat stew. He owns a map of the region that makes it twice as likely to become lost (disregard roads and rivers when determining this, using the surrounding terrain) and if the PCs become lost, the map rewrites the surrounding land so that whatever direction the PCs go, where they thought they were going is there instead of where it should be.",,
11,23,,1123,fin,THISTLETHRALL,,Zak Smith,THISTLETHRALL (settlement) the Elves here dissolve the those who bore them in acidic pits.,,
11,24,,1124,fin,,,Jürgen Mayer,An earth elemental is looking for victims to sacrifice to the God of Dirt. Neutral clerics may have a chance to reason with it.,,
11,24,,1124,fin,HELVIZ FOLLY,,Gus L,"HELVIZ'S FOLLY - Town of 36 souls, but with neat brick buildings for several hundred more residents.",,
11,25,,1125,lake,,,Richard Rush,A band of marauders who raid nearby areas mounted on armored hippopotami make their camp on a small island in the middle of this lake. Magical amphorae keep their animals hydrated when they range beyond its shores.,,
11,26,,1126,woodland,,,Trent B,"Thick forest contains various fungus, some edible, some poisonous. Some (1 in 6, if chosen randomly) turn eater into a myconid/fungusman in D6 days (con save)",,
11,27,,1127,woodland,SUNNYHILL,,Trent B,"SUNNYHILL - settlement. A hillside of 260 halflings, (relatively) recently moved here from [[1220]] because the cruel leeches in [[1120]] kept stealing children. Leeches and, more recently, fungus are explicitly illegal. Possession punishable by mutilation.",,
11,27,,1127,woodland,NINE NEERING,,Zak Smith,"NINE NEERING (settlement) Lord Frast is generous and obliging, but his disturbed halfling clown seeks to supplant him and feed him to the apes in [[1026]].",,
11,28,,1128,woodland,,,Reece Carter,"There is something special hidden deep in the forest here, but its protected by the forest itself. The forest paths will change, the trees will attack, the random animals will ambush and then lead the party astray, even the weather doesnt want it found. What it is? No one knows",http://gamingithappens.blogspot.com.au/2013/08/random-forest.html,
12,01,,1201,hill,,,Zak Smith,A princess heads south with her retinue to marry one of the ogre mages in [[1006]]. She is a weretiger and preys on the nearby idiots in [[1101]] and [[1102]].,,
12,02,,1202,sea,,,Reece Carter,water elementals are attacking at the sheer cliff faces along the edge of the hex trying to make their way into [[1201]].,,
12,03,,1203,sea,,,Steve Sigety,Corpse of a pirate strapped to a barrel with steel chains -- a warning to other mutineers. The barrel is full of gunpowder.,,
12,04,,1204,sea,,,Trent B,"An abandoned barge. Some supplies, no treasure.",,
12,05,,1205,plain,,,Martin Bay Thomsen,Gorgon-Minotaurs chariot racing in marble arena.,,
12,06,,1206,sea,,,Trent B,The support upright remains of a six mile bridge running north south.,,
12,07,,1207,plain,,,Trent B,"On the shore near the remains of the bridge, someones long abandoned equipment lays against a tree, wrapped in a waterproof cloak. 55 gp, adventure gear, sword, writing material and a footnoted book on dwarven construction methods.",,
12,08,,1208,plain,,,Trent B,"A tribe of aloof humans, involved in the tribal warfare in [[1007]]. They are clad in newly made leech masks and dark, segmented cloaks. They appear to be preparing for an expedition.",,
12,09,,1209,woodland,,,Matt Maranda,The woods are inhabited by Dryads that hide from the savages of [[1208]] and created the worm to keep them distracted. They would gladly pay with healing and the bounty of the forest if anyone could depose the witches from [[1109]].,,
12,10,,1210,fin,GREASEGRAFT,,Zak Smith,"GREASEGRAFT friendly, usually quiet settlement. Nearby: a fortress inhabited by goblins wearing iron warmasks.",,
12,11,,1211,hill,,,Claytonian JP,"a gigantic, though fairly innocuous, armored worm. The worm passes through everything like a ghost and feeds on auras.",,
12,12,,1212,sand,,,Brian Green,Contains a hidden gargantuan trapdoor spider lair.  Lair is inhabited by a tribe of primitive desert elves who slew the spider generations ago.,,
12,13,,1213,hill,,,Trent B,"A giant, silver-black owl, 7HD, stalks these mountains at night, feeding on anything smaller than a horse. It attempts to drag larger prey off cliffs and there is decent treasure in its lair.",,
12,14,,1214,plain,,,Matt Maranda,"The Keep Bael Beauty, is a strong well supplied castle. All who attend Bael are beautiful and it is said the lord himself is so gorgeous that his stare can turn others into his servants.",,
12,15,,1215,plain,,,Ray Colina,"Halflings from [[GALASSA]] [[0315]] struggle with an exceptionally beautiful shaggy horse, from of the herd in [[0821]]. They plan to take the horse back to [[0316]] to be sacrificed. The horse is an exceptional animal, worthy of being a Paladin's mount if rescued; if no suitable paladin is present it will return to its herd.",,
12,16,,1216,plain,,,Reece Carter,"a open grassy planes, nothing special to see here, in fact to spot something you roll at +2. Roll on a wondering monster table",,
12,17,,1217,sand,,,Trent B,"An abandoned iron mine and settlement. A mile in, the mine breaks into a vast mile deep cavern.",,
12,17,,1217,sand,,,Random Wizard,Self flagellating deathwish pilgrims are wandering lost here. They will offer what meager coin they have for directions to the town at [[0711]] but will attempt to kidnap the weak and unwary as offering for their death god.,,
12,18,,1218,woodland,,,Stuart Marshall,"Forest.  Treant is under a curse and has 1d4 golden apples growing from its branches, picking them is extremely painful for it.",,
12,19,,1219,woodland,,,Steve Sigety,A tribe of peaceful centaurs make their home in the woods. They warn travelers about the archanotech-mummies in hex [[1317]].,,
12,20,,1220,woodland,,,Trent B,An abandoned halfling hill. Currently being investigated by 4 leech headed halflings.,,
12,21,,1221,lake,,,Trent B,A lake! 3 crocodiles. Not claw claw bite.,,
12,22,,1222,lake,,,Noah Marshall,More Lake! The swampy ill-defined southern border of [[1221]]. A sunken castle whose three exposed towers are home to a tribe of 22 Gatormen.,,
12,23,,1223,plain,,,Matt Maranda,"A lost caravan of halflings are attempting to return to the village in [[1127]]. If searched they have several barrels with mushrooms hidden inside, but deny all knowledge of truffle hunting and most certainly not in forests [[1323]].",,
12,24,,1224,plain,,,Claytonian JP,"This grassy area is a favorite of the Claw Claw Bite Society, a group of battle reenactors. If the PCs have heroic ancestors, someone will be taking said ancestors' role, probably to the dissatisfaction of the PCs.",,
12,25,,1225,woodland,,,Steve Sigety,"In a clearing, a wicker basket containing one suit of gnome-sized crabshell armor.",,
12,26,,1226,lake,,,Ray Colina,The lake waters here are algae filled. A giant bass lurks beneath the waters.,,
12,27,,1227,woodland,,,Ray Colina,"The monkey people from [[0505]] have built a tree-fortress here. They are hostile to outsiders. Baboon people also roam here, they make almost daily raids on the monkey people.",,
12,28,,1228,,,,,,,
13,01,,1301,hill,,,Trent B,"A small coterie of fisherdwarfs live here, 4 males and their families. They trade their surfacefish with the denizens of the endless tunnels below their homes and therefore having interesting tunnel-goods to trade to travellers.",,
