x_index,y_index,extra_1,hex_key,terrain,settlement,extra_2,author,description,more_info_url,themes
04,27,,0427,fin,,,Wayne Snyder,The ground here is littered with stone turtles. An evil skeleton loiters in the area waiting to trick passers-by with its bogus prophecies.,,
04,28,,0428,,,,,,,
05,01,,0501,sea,,,Ray Colina,"Schools of crystalline-flying fish with razor sharp wings frequent these waters, 50% chance of encounter. If caught they can fetch a decent price from the right buyer.",,
05,02,,0502,sea,,,Jason Sholtis,A ramshackle boat full of sea hippies cruises about looking for a market for their hand crafted doo-dads.,,
05,03,,0503,sea,,,Reece Carter,"its rumoured that there is an opening to an underwater cavern here. when inside of said cavern you can breath water as though it was air (water acts as air), but air can cause you to drown (treat as water)",,
05,03,,0503,sea,,,Alex Williamson,A long abandoned catamaran is anchored above a pearl bed inhabited by giant oysters and 4 Ixitxachitl who prey on those who may investigate.,,
05,04,,0504,sea,,,Adam Thornton,Shoals off the coast are full of stinging jellyfish.  Sea cows here moan in suspiciously human voices.,,
05,04,,0504,sea,,,David Pretty,Reef!  A Seamanship / Navigation check is required or your vessel will run aground.  Some spots are so shallow swimmers can climb up and be completely out of the water.,,
05,05,,0505,fin,,,Wayne Snyder,Thunderous surf crashes on beaches of black volcanic sand. Indigenous monkey people sift diamonds from the sands with loose weave wicker baskets.,,
05,06,,0506,plain,,,Jack Mcnamee,Secret beach hosts massive Ghost Dance on the full moon.,,
05,07,,0507,sea,,,Wayne Snyder,Colorful coral reefs lie just below the waters surface. This is the spawning place of the merfolk.,,
05,07,,0507,sea,,,Jeff Rients,"The fishing is really good here, so good even untrained observers will notice it.",,
05,07,,0507,sea,,,Jack Mcnamee,Burnt remains of viking funeral barge under the water. Full of the usual viking treasure and rotting skeletal warriors.,,
05,08,,0508,sea,,,Alex Williamson,The last remaining pylon of a colossal basalt bridge that spanned from [[0407]] to [[0608]] rises from the water here. It is now used as the nesting place for several families of giant albatross. Their eggs are prized for those who would use the young as mounts.,,
05,09,,0509,sea,,,Ben Djarum,"A wild-haired man, his body covered in strange symbols, is tied screaming to a raft.",,
05,10,,0510,sea,,,Justin Howe,Three barrels of brandy float in the water. They fell off a smuggler's ship in a storm.,,
05,11,,0511,hill,,,Jack Mcnamee,Rocky cliffs prevent landing.,,
05,12,,0512,hill,,,Wayne Snyder,Low sandy hills infested with smart mouth harpies.,,
05,13,,0513,mountain,,,Anthony Picaro,"This mountain is an active volcano with an eruption impending; roll 1d12 each time PC pass by or view the mountain from a distance: 1-3 nothing, 4-8 minor tremors, 9-11 distressing smoldering, 12 eruption. The lava flow will head Northeast to the sea, through hexes [[0512]] and [[0612]]. After the eruption, the lopsided face of the volcano looks strangely like the profile of a lost dwarven king.",,
05,13,,0513,mountain,,,John Carr,"Termite mounds hundreds, even thousands of feet high",,
05,14,,0514,woodland,LENINA,,Ben Djarum,The small village of Lenina. A blacksmith's son has become possessed by an evil spirit. He is bound in shackles and locked away in an old barn. At night he cries out the names of the villagers and the dates and ways in which they will die.,,
05,15,,0515,hill,,,John Carr,These hills have eyes: a beholder spawning site just beneath the surface,,
05,16,,0516,plain,,,Patrick Henry Downs,A smoldering campfire that appears to have exhausted it's fuel within the last day. A small opened belt pouch sits in the middle of three charred bodies lying fifteen feet to the east of the fire pit.,,
05,17,,0517,plain,,,Wayne Snyder,Abandoned silver mine. D10 Kobolds.,,
05,17,,0517,plain,,,Jack Mcnamee,"2d10 Chaotic pilgrims cruising for sick thrills. Led by The Devil Himself, a third-level cleric.",,
05,18,,0518,plain,,,Richard Rush,An angry mother bear rages because her cub has been caught in a trap.,,
05,18,,0518,plain,,,Ben Djarum,Three escaped refugees from the Oakheart Academy [[0304]] are hiding in the trees on this rocky plateau. They are being menaced by a pack of 8 grizzly bears.,,
05,19,,0519,fin,,,Zak Smith,"Pile of slain deodands--same tribe as those in [[0418]], apparently slain by the amazon in [[0419]].",,
05,20,,0520,mountain,,,Casey Garske,Moonlight shining through the Needle from [[0321]] illuminates the Moon Goddess's temple on this mountainside.,,
05,20,,0520,mountain,,,Jack Mcnamee,"Weeping statue looks towards sister on peak of [[0816]]. If their gazes are aligned, a chasm will open at [[0618]] leading to lost city.",,
05,21,,0521,mountain,,,Jacob Hurst,"Large demon stands before a bridgeless chasm. Compelled to aid those who wish to cross, but acts aggressively in the hopes of triggering combat and slaying or being slain (reappears in 24 hours) so he doesn't have to help.",,
05,22,,0522,plain,,,Ben Djarum,A cenotaph covered in choking vines of ivy. Hidden within the vines is an entrance to a dungeon beneath.,,
05,22,,0522,plain,ROPETOWN,,Ray Colina,"ROPETOWN, most who live in this town either grow hemp, or make rope. The town headman, Mangai, will pay 500 gp, for the return of his feckless son, Lein the Ropesmoker, who ran off to be one of the sea hippies in hex [[0502]].",,
05,23,,0523,mountain,,,Jack Mcnamee,"Treacherous path, 60% chance of blizzard. 8 wolves.",,
05,24,,0524,fin,,,Olman Feelyus,"Beautiful alpine lake, crystal clear, cold, excellent for drinking, washing and fishing.",,
05,25,,0525,fin,,,Jack Mcnamee,20 Nomadic hill people.,,
05,26,,0526,fin,,,M Nicksic,"Mastodon graveyard, reverently avoided by nomadic tribes. Disturbing remains has a 60% chance of angering a random God with Animal/Nature/Mastodon portfolio.",,
05,27,,0527,fin,,,Trent B,Travelling Minstrels! Currently composing a ballad about the contents of hex (D20) (D20+6),,
05,28,,0528,plain,,,Ray Colina,A grove of tall trees has 2-24 giant bees.,,
06,01,,0601,woodland,,,Anthony Picaro,"No animal found on this forested peninsula has any teeth, each choking down their food whole. Otherwise healthy.",,
06,02,,0602,woodland,,,Ben Djarum,"Suicide Cult of Moon Elves are gathered in a circle of stones, awaiting a meteor to streak across the sky.",,
06,03,,0603,sea,,,Ray Colina,"Flotsam. If night, the strange mournful calls of some unknown sea creature.",,
06,04,,0604,sea,,,M Nicksic,"The shipping channel is filled with d20 mines from some long ago war. These masterwork mines are all crafted to resemble eye tyrants, and each has a 1 in 6 chance of still being active.",,
06,05,,0605,swamp,,,Eric Boyd,"Haunted salt marsh/tide flats- basically a group of small islands at high tide. On arrival and every 30 minutes, roll a d8: if 1, a ghost; 2-3. a of 3d4 sea-ghouls in ancient rotted soldier's uniforms",,
06,06,,0606,swamp,,,Ray Colina,"Half sunk into the black waters of this fetid swamp is the Iron Tower of the Space Vampire. Giant frogs, apparently not bothered by the cold, are common here.",,
06,07,,0607,sea,,,Ben Djarum,Abandoned lighthouse,,
06,08,,0608,plain,,,Ray Colina,The tribesmen here fish from dugout canoes. They tend to a dying sailor from [[VEKTH]] [[0209]]. Hidden in his dagger’s scabbard is a map to the dungeon in hex [[0522]].,,
06,09,,0609,sea,,,Zak Smith,Small island temple surrounded by a flotilla of miniature wooden boats. Worshippers come here and place messages to the Gods of the Chrysanthemum Sea in these boats and wait for the tide to take them and interfering with one has a 5% chance of bringing a water-breathing-only curse down on the blasphemer.,,
06,10,,0610,sea,DASTREICH VALE,,Zak Smith,"DASTREICH VALE  Hyrax Vooreal and his 20 werewolf minions rules this fortified island city, sacrificing those who displease him to the Goddess of the Gibbous Moon.",,
06,11,,0611,sea,,,Zak Smith,"Palace of 1000 Terraces (Island Castle) Originally built 1000 years ago as a summer estate for the NegaTsar, it contains overgrown gardens, winding stairs, chimes, parlors. It was so beautiful, the NegaTsar used to have everyone who saw it drowned.",,
06,12,,0612,hill,,,Ray Colina,"A squat lonely tower is home to Dagan Zur the Transmuter, wizard and avid entomologist. Dagan Zur spends hours each day scrying with his crystal ball for new insects to study and catalog. He has secretly fallen in love with the Mosquito Queen [[0127]] and will seek to punish any who bring harm to her.",,
06,13,,0613,fin,,,Zak Smith,The Pool of Heal and Harm: In the daylight the pool is red. Anyone getting in the pool takes 2d12 points of damage. At night the pool is clear blue. Anyone getting into the pool heals 2d12 hits. (stolen from Majestic Wilderlands),,
06,14,,0614,fin,,,Ray Colina,"Atop a flat-topped hill is the decapitated head of a statue, some fourteen feet tall on its side. It depicts the face of a gaping fish-man.",,
06,15,,0615,mountain,,,Ben Djarum,"Battle Arena of Ras Rachtan - A colossal, oval-shaped arena filled with giant stone statues called The Rachtan. By using a series of spells and controls, one can animate the Rachtan to battle one another. Rachtan betting is serious business.",,
06,16,,0616,woodland,,,Zak Smith,"Grigs and pixies turned hostile by Dagan Zur in [[0621]] in a black tree that grows sideways. Their treasure includes 9000gp, a land deed to Vornheim and a mangled taxidermized miniphant that contains a small die which is actually a lich's phylactery.",,
06,17,,0617,plain,,,Jensan Thuresson,Pack of undead birds.,,
06,18,,0618,plain,,,Trent B,"Wild Boar, an abandoned homestead and an overgrown orchard, claimed by the wild.",,
06,18,,0618,plain,,,Justin Howe,Group of statues in various hostile poses that are actually adventurers that were turned to stone by long dead basilisk.,,
06,19,,0619,fin,,,Ray Colina,The 36 tribesman who live in these hills are actually wereboars. They are forced to give tribute to  Hyrax Vooreal [[0610]] and are bound from attacking him directly. They seek proxies to relieve them of this burden.,,
06,19,,0619,fin,,,Rob Acton,Blasted craggy hills that have been sculpted by the NE wind into the shapes of the totems of the Argui Tribe.,,
06,20,,0620,mountain,,,Trent B,Dwarven Skeletons patrol here at night. Any severed skeleton pieces will attempt to crawl back to the entrance to the subterranean dwarf skeleton dungeon with treasure and curses and tragedy.,,
06,21,,0621,plain,,,Zak Smith,Giant Flail Snail--20' tall. Shell is worth 10x normal price.,,
06,22,,0622,plain,GAGORUM,,Ray Colina,"GAGORUM the Nomad City is made up of scores of ancient stone houses and other buildings, each made from a solid piece of an unknown green stone. It is a ghost-town most of the year, but during the winter months the nomadic tribes of the region gather for a great moot.",,
06,23,,0623,plain,,,Trent B,"Fishing Hamlet - Fish the shores of the lake in [[0723]]. A  certain type of Lake Squid has fine fibres, which are used to make luxurious, soft and strong clothing here.",,
06,24,,0624,plain,CASTLE ABATTE,,Zak Smith,Castle Abatte: Abatte is a petty warlord he employs the best chefs in the realm. Obliging when he wants something--will pay 10x the price for exotic ingredients or spices.,,
06,25,,0625,plain,,,Reece Carter,"dark deep forests, nothing special in here, just scary darkness",,
06,26,,0626,plain,,,Reece Carter,"more dark deep forests, but here there be spiders, trap door spiders and goldern orb spiders (but medium-large sized)",,
06,27,,0627,plain,,,Ray Colina,"Within a massive termite mound like structure lives a Bee Demon. It trades its demon-honey, valued for its endurance enhancing properties, for betrayed confidences and broken promises.",,
06,28,,0628,,,,,,,
07,01,,0701,plain,,,Zak Smith,"A single large snow leopard lives here, it is sacred to the moon elves who live here ( 06 02 ) and is the only animal in the area with teeth.",,
07,02,,0702,sea,,,Reece Carter,"this area is prone to rip tides, they are very strong and very long",,
07,03,,0703,sea,,,Ian Burns,Remains of a prehistoric shark lie of the sea floor.,,
07,04,,0704,sea,,,Zak Smith,Hyperintelligent monkeys from [[0505]] are posing as ordinary pets and plan to take over the merchant vessel--The Dawn Bream--moored at the island here.,,
07,05,,0705,sea,,,Ian Burns,"Small village of 61 honorable fisherman constructed of 12 large, wooden rafts banded together and floating at sea.",,
07,06,,0706,swamp,,,Zak Smith,3 Intelligent foxes hunt the marsh. All know Suggestion . They trapped the princess in [[0707]].,,
07,07,,0707,sea,,,,"The princess trapped in a magical island gibbet here can enslave the minds of men for 24 hours at a time, but can only be freed speaking the ancient spell written into the sigils of the fish in 01 22.",,
07,08,,0708,fin,,,Ian Burns,Cliff-side monastery of 23 blind elves that nontheless fight a 6th level fighters dedicated to the appeasement of the Lurker of Endless Night. 1d20 x 1d20 GP worth of valuables within.,,
07,09,,0709,plain,WROTHWHEEL,,Zak Smith,"WROTHWHEEL (settlement) Baron Cytorrak, who rules here, is cruel but respects the Gods of the Chrysanthemum Sea [[0609]]. The prayers in his devotion vessels contain clues to his intrigues with Abatte [[0624]] and the wizard in [[0411]] .",,
07,10,,0710,sea,,,M Nicksic,The unusually clear water reveals a vast sponge field. Ingesting the sponges causes nausea and strange visions which allow the eater to see the future as if the had cast Augury.,,
07,11,,0711,woodland,,,M Nicksic,A small fishing village has grown wealthy catering to a strange sect of deathwish pilgrims who travel to see the palace in [[0611]] knowing they will be put to death by the NegaTsar.,,
07,12,,0712,sea,,,Zak Smith,A statue of the Bringer of Endless Night is sunk beneath the water here. It is sacred to the Ixitachitl in [[0503]].,,
07,13,,0713,sand,,,Ian Burns,Sixteen greedy dwarves hopelessly pan the many rivers and streams in this hex for gold.,,
07,14,,0714,mountain,,,Zak Smith,Inside a sturdy watchtower is what appears to be a statue of an elf looking in the sky to the east. It was the first intelligent creature to discover that the reclusive dragon roosting in the peaks at [[1413]] is actually a dracolisk.,,
07,15,,0715,mountain,,,Zak Smith,"Ancient elven burial city now occupied by a necromancer. She is served by a disturbing variety of undead birds (ghoul crows, skeletal vultures, bloodfalcons etc)--including those in [[0617]].",,
07,16,,0716,mountain,,,Ian Burns,Remains of an ancient battle between Elven and Goblins kind. Followers of the Many Headed God morn this sight.,,
07,16,,0716,mountain,,,Reece Carter,"here is the caves of the goblin heroes, it has many a valuable item in here, and the goblins who live here fight as a 3-4 level rogue and 2-3 level fighter (multi-class)",,
07,17,,0717,plain,,,Zak Smith,Vyrvalis (settlement) this was once an enormous elven city made entirely of geometrically carved white marble with circular openings for doors. Now it is mostly overgrown and supports a small population of traders and hunters.,,
07,18,,0718,plain,,,Ian Burns,Seven giant hogs branded in the left buttocks.,,
07,19,,0719,woodland,,,M Nicksic,"d20 Rabid monkeys hiding in the trees pelt intruders mercilessly with extremely hard nuts (treat as slingshot) and will attempt to steal small, shiny objects during the night from people foolish enough to camp here.",,
07,20,,0720,woodland,,,Zak Smith,Dwarves hunting wereboars [[0619]] through the ruins of a vast temple complex that used to be adjacent to Vyrvalis [[0117]].,,
07,21,,0721,plain,,,Anders Nordberg,Camp of the Dwarven expedition searching for clues to the secrets of Vervalis [[0117]] in the nearby Dwarf Skeleton Dungeon [[0620]]. Most are hunting boars in the nearby forest [[0720]].,,
07,22,,0722,plain,,,M Nicksic,"At the junction of two major trade routes, a low, rambling inn does a brisk business selling barbecued pork to travelers. They will grill anything for the right price.",,
07,23,,0723,lake,,,Wayne Snyder,"A shallow lake completely fills this grim valley. The water is murky, almost black with silt and infested with giant eels.",,
07,24,,0724,swamp,,,Mike Evans,"A group of twenty two statues of ugly haggard woman that face away from one another, circled around carving of full moon.  Babbling and nonsensical mutterings are heard passing between them.  When the moon is full the statues face each other and sing warnings of [[0416]].",,
07,25,,0725,swamp,,,Jeff Rients,"Stankbog, muddy human village of 150 wretches that worship the Great Swamp Gas, a nearby Will-o-Wisp.",,
07,26,,0726,plain,,,Mike Evans,"Mountain man lives in rickety cabin.  Practices taxidermy and talks to his stuffed animals, hoping one day they'll talk back.",,
07,27,,0727,plain,,,Chris Blauwkamp,A statue of a okapi stands alone. It is disturbingly realistic.,,
07,28,,0728,plain,,,M Nicksic,A herd of mastodons are escorting their dying matriarch to the graveyard at 05 26. D6+2 nomadic tribesmen are observing and will attempt to thwart anyone interfering with the procession.,,
08,01,,0801,sea,,,August Aronsson,"Iceberg adrift, with ruined camp of gnomish polar explorers, inexplicably killed.",,
08,01,,0801,sea,,,Thomas Fitzgerald,Empty coracle floats alone,,
08,02,,0802,sea,,,,,,
08,03,,0803,sea,,,Ray Colina,"A hopelessly lost flotilla of small vessels, pilgrims from [[VEKTH]] [[0209]] seeking the island temple in [[0609]]. They will ask the Gods of the Chrysanthemum Sea to smile upon any who set them back on course.",,
08,04,,0804,woodland,,,Ray Colina,"The trees in these woods make fine dugout canoes. Two tribes live here, one of them practices ritual cannibalism.",,
08,05,,0805,sea,,,August Aronsson,Isolated community of ex-sailors only admits settlers who are afflicted by scurvy. Fresh fruit is confiscated by the authorities.,,
08,06,,0806,sea,,,Matthew Burack,"A fishing boat carrying a salty ex-soldier turned fisherman, a young scholar, and a paladin. They are hunting a giant devil-shark.",,
08,07,,0807,sea,,,Matt Maranda,the wreckage of 5 ancient longboats can be found here. They hold a treasure guarded by the restless spirits of ship crews.,,
08,07,,0807,sea,,,Brendan S,"Placid waters, an area frequently plied by pleasure barges of decadent nobles (guarded by heavily armored janissarys). They will sometimes pay adventurers to engage in gladiatorial combat.",,
08,08,,0808,fin,,,Ray Colina,"The burial mounds here hold the most honored dead of local nomadic tribes. One of the mounds has recently been broken into or out of, whatever was inside is gone.",,
08,09,,0809,plain,,,Matthew Burack,"A hamster in a magic sphere slowly rolls his way across the landscape. The hamster needs no water, food, or air and is completely immune to all harm while the globe is intact.",,
08,10,,0810,sea,,,Ray Colina,"The cloaked figure sailing a skiff is actually the powerful skeleton, Zox (7HD, claws, fires green magic missiles from its emerald eyes). Every year, his mistress, the necromancer in [[0715]], sends him to gather magic mushrooms that grow in [[0711]], this year the mushrooms were gone, taken by the sea hippies in [[0502]]. Fearful of returning empty handed, he demands any vessel he comes across allow him to search their ship, attacking if he is refused.",,
08,11,,0811,sea,,,Joey Lindsey,"Dense overgrowth along the bank hides a cave entrance. Inside the cave, the path West is a dungeon where undead dwarves toil fruitlessly; the other exit is in [[0406]]. The underground path East has a track and ancient mining cart, with an eventual opening to an owlbear cave in [[1312]].",,
08,12,,0812,woodland,,,Darien Mason,a leprechaun guards his pot of gold. He has health issues and will pay handsomely for a sack of prunes/,,
08,13,,0813,plain,,,Ray Colina,"A party of 2-8 Ice Trolls hunt here, amongst their possessions is a tattered map written in a forgotten language. It details how to use “The Needle” in [[0321]].",,
08,14,,0814,plain,,,Martin Bay Thomsen,"Golem Factory: Crafter hos gone mad and created a sentient flesh golem that has taken over his factory. It is turning everything suitable into golems (including but not limited to: the entire contents of the crafters treasury, obsidian decor, the pantry, the bedroom linens etc.) The flesh golem has an extremely long, six-jointed arm and 3 heads. It desires to have its creator's face sown onto it.",,
08,15,,0815,mountain,,,Martin Bay Thomsen,Paranoid man living in a gazebo. He has a bone scalpel that protects him from anyone whose name he carves in his skin.,,
08,16,,0816,mountain,DAMNATION,,Ray Colina,"DAMNATION a sprawling ramshackle boom-town of tents and rickety lean-tos has sprung up in a windy valley here after the discovery of mega-dungeon. It is wretched hive of scum and villainy nearly as dangerous as the dungeon itself. Recently, unknown arsonists have taken to setting fires in order to loot in the wake of the chaos.",,
08,17,,0817,fin,,,Matt Maranda,These plains contain several cairns spread in a circular formation over  a 4 mile radius. At the center is a very large barrow with a low entry.  Deep bellow the barrow lies a helmet sized to fit in the throne of hex [[0119]] and is capable of making sense of the visual panoply present there.,,
08,17,,0817,fin,,,Darien Mason,A pair of manticores are cursed to guard an orchard of plum trees. Any vegetation they try to eat shrivels in their paws.,,
08,18,,0818,hill,,,Martin Bay Thomsen,Pastel colored lime pit,,
08,19,,0819,woodland,,,Joey Lindsey,"Thin stretch of forest with poison ivy, mosquitos, dragonflies, songbirds.",,
08,20,,0820,plain,,,Matt Maranda,At the edge of the forest and guarding the plains is the fort and trading town of Axerist.,,
08,21,,0821,plain,,,Ray Colina,"Shaggy wild horses run through these plains, if captured and broken, they will make fine mounts.",,
08,22,,0822,woodland,,,Joey Lindsey,"An exceedingly shy Dryad lives in this sparse copse. She is feral, possibly rabid, and feeds on the eels from the lake in [[0723]]. The local animals are afraid of her.",,
08,23,,0823,fin,,,Jason Sholtis,"Pugnacious clan of hill giants walk around with black eyes and bruises from their incessant squabbling, subsist on diet almost entirely of giant eels from [[0723]]. They dress in skin-tight eel skin leggings, sport eel tooth jewelry, smell like eels and are actually quite slippery.",,
08,23,,0823,fin,,,Darien Mason,"The secret t' cookin' giant eels, y'see, is y'gotta put 'm in a tub and feed 'm loaves of bread for a couple weeks t' clean 'm out. Then they's delicious!",,
08,24,,0824,fin,,,Zak Smith,"Was once an office of the local taxation department of the NegaTsar, now in ruins. Contains a hidden vault containing 4500gp, reams of documents with the suspected locations of various ancient potentates' hidden treasure, and the descendants of a pack of  wolfdogs the tax collector bred to protect him on his travels.",,
08,25,,0825,fin,,,Zak Smith,"Corpse of a hill giant from [[0823]] ripped apart by wild dogs from [[0824]]. Has 345gp, 2-handed sword (a sword to him), and clear footprints leading from the north.",,
08,26,,0826,fin,,,Zak Smith,Cathedral of an ancient insect cult related to the Mosquito Queen in [[0127]]. It and the tunnels beneath are in the process of being sacked by goblins who are fighting huge walking wasps in the tunnels. Some of the goblins have begun to develop strangely faceted eyes and wasplike legs.,,
08,27,,0827,plain,,,Casey Garske,An apatosaurus corpse is being scavenged by a pack of deinonychus.,,
08,27,,0827,plain,,,Joshua Macy,"Ancient monolith.  The shadow of the monolith will teleport anyone standing fully within it 1d6 hexes in the direction its currently pointing, as long as that's not off the edge of the map (due to the lay of the land it casts no shadow in directions that would be off the map).",,
08,28,,0828,,,,,,,
09,01,,0901,hill,NYNGLOOM CASTLE,,Zak Smith,NYNGLOOM CASTLE Surrounded by hundreds of ships beached after a tide-lowering spell cast during a catastrophic war. Infested with carrion crawlers.,,
09,02,,0902,hill,FELLMOUNT ABBEY,,Chris Blauwkamp,"FELLMOUNT ABBEY An abbey of monks sits in these hills, brewing beer. 20 years ago, the monks were replaced by dopplegangers, who continue to brew quite good beer.",,
09,03,,0903,sand,,,Matt Maranda,"A sinkhole 3 miles long, over 200' feet across at its widest and incredibly deep scars the land here. The air around it smells of methane.",,
09,04,,0904,fin,,,Jason Sholtis,"Procession of bat-like methane-breathers from [[0903]], fleeing some terror worse than death from deep below, all collapsed in a heap. They need concentrated methane fast!",,
09,05,,0905,woodland,,,Alex Williamson,A great tree dominates a clearing here. Its upper branches are home to a nest of benevolent but mischievous couatls.,,
09,06,,0906,woodland,,,Casey Garske,Kleptomaniacal monkeys bring their ill-gotten gains to the coatls in [[0905]]. The coatls may ask a favor to have the items returned.,,
09,07,,0907,sea,,,Jason Sholtis,Waters teeming with millions of luminous jellyfish including one colossal telepathic jellyfish oracle who will answer any question with 100% accuracy for a single human sacrifice.,,
09,08,,0908,fin,,,Simon Forster,"in the ruins of a castle are a dozen bronze-soldiers, automatons that march and fight when military-styled music is played.",,
09,08,,0908,fin,,,Ben Djarum,the petrified remains of a colossal whale. The bones and ossified digestive tract of the creature has created a vast labyrinthine system of passages.,,
09,09,,0909,fin,,,Asen R Georgiev,"A city amidst swamps, that blocks the safest route through the treacherous ground. It takes a tax of 5% on any valuables one wants to bring through it, not just trade goods.",,
